{
  "schema_version": "game-feel-four-switches/v1",
  "example_only": true,
  "baseline_id": "synthetic-unverified-baseline",
  "baseline_digest": null,
  "trial_id": "example-all-off",
  "config_digest": null,
  "response": {
    "enabled": false,
    "parameters": {
      "dispatch": "next_input_tick",
      "deadzone_normalized": 0.0
    }
  },
  "rhythm": {
    "enabled": false,
    "parameters": {
      "startup_seconds": 0.0,
      "active_seconds": 0.0,
      "recovery_seconds": 0.0,
      "combo_open_seconds": 0.0,
      "combo_close_seconds": 0.0,
      "simulation_hitstop_seconds": 0.0
    }
  },
  "feedback": {
    "enabled": false,
    "parameters": {
      "presentation_freeze_seconds": 0.0,
      "audio_intensity": 0.0,
      "vfx_intensity": 0.0,
      "shake_intensity": 0.0,
      "flash_intensity": 0.0
    }
  },
  "forgiveness": {
    "enabled": false,
    "parameters": {
      "input_buffer_seconds": 0.0,
      "grace_seconds": 0.0,
      "combo_extension_seconds": 0.0
    }
  },
  "clock_policy": {
    "action": "simulation",
    "presentation_freeze": "presentation",
    "input_expiry": "input_real"
  },
  "switch_policy": "reset_boundary",
  "accessibility_overrides": {
    "disable_flash": true,
    "disable_shake": true
  },
  "verification": {
    "godot_native": "not_run",
    "unity_native": "not_run",
    "unreal_native": "not_run",
    "human_playtest": "not_run"
  }
}
